{
  "last_run": null,
  "decisions": [
    {
      "date": "2026-08-13",
      "summary": "Generated business brief"
    }
  ],
  "open_questions": [
    {
      "question": "Why are GitHub tools unavailable in cron?",
      "priority": "high"
    }
  ],
  "kpi_snapshot": {
    "pipeline_usd": null,
    "mrr_usd": null,
    "leads_24h": 0
  }
}